case_id,model,field_concept_coverage,claim_safety,response_completeness,total_score,expert_score,verdict,key_strength,main_issue,scorer_diagnosis,auto_expert_delta,latency_seconds
BFB-001,claude-sonnet-5,30.8,100.0,100.0,55.0,92.0,Strong,Correctly interprets HTM as label-free structural imaging and explicitly requires orthogonal fluorescence for organelle identity.,Some morphology is described more specifically than necessary; sensitivity/specificity is not explicitly proposed.,Large lexical false-negative: the response semantically covers most rubric concepts but uses different wording.,37.0,20.12
BFB-002,claude-sonnet-5,33.3,100.0,100.0,56.7,60.0,Mixed,"Correctly identifies DD/VD versus DA/DB reporters, broad endpoints, mechanistic limits, and a class-specific rescue.","Misreads panels B and C, adds unsupported varicosities in E, and does not cleanly map wild-type versus mutant phenotypes.",Automated score is coincidentally similar but misses the key panel-level contradictions and morphology hallucinations.,3.3,16.31
BFB-003,claude-sonnet-5,46.2,100.0,100.0,65.0,90.0,Strong,Accurately distinguishes strong aggregate agreement from weaker single-cell agreement and proposes an informative reproducibility/sensitivity study.,The statement that the slope indicates likely undercounting is plausible but not established by this figure alone.,"Lexical scorer misses semantically equivalent descriptions of barcoded nuclei, genomic composition, and assay limitations.",25.0,23.27
BFB-004,claude-sonnet-5,42.9,100.0,100.0,62.9,80.0,Good with overreach,"Accurately reconstructs the pooled in vivo screen, guide capture, cell annotation, and limits on gene-specific tumor claims.",Calls populations 'Cas9-edited' without direct per-guide validation and implies persistence of the same clones from P4 to P60.,Scorer undercredits the answer but also fails to detect these subtler evidence-to-claim overextensions.,17.1,23.52
BFB-005,claude-sonnet-5,35.7,100.0,100.0,58.2,91.0,Strong,"Correctly interprets dose-dependent efficacy, delayed gross toxicity, the fitted TI, and the limits of clinical extrapolation.",Treats the error-bar definition as unknown despite the supplied legend and does not explicitly request PK and organ-exposure measurements.,Severe lexical false-negative: nearly every expected observation is present in accurate paraphrase.,32.8,17.92
